{
  "$schema": "http://json-schema.org/draft-07/schema#",
  "title": "AI4IA model catalog",
  "description": "Data-driven Foundry model deployment catalog consumed by infra/main.bicep.",
  "type": "object",
  "required": ["naming", "regions", "catalog"],
  "properties": {
    "$schema": { "type": "string" },
    "_comment": { "type": "string" },
    "productionCapacityPolicy": { "$ref": "#/definitions/productionCapacityPolicy" },
    "naming": {
      "type": "object",
      "required": ["subscriptionToken", "foundryToken", "pattern", "skuShort"],
      "properties": {
        "_comment": { "type": "string" },
        "subscriptionToken": { "type": "string", "minLength": 1, "description": "Token stamped into every model deployment name ({model}-{subscriptionToken}-{region}-{skuShort}). Read by bicep + the catalog scripts + the runtime; change it (per tenant/subscription) and regenerate the catalog." },
        "foundryToken": { "type": "string", "minLength": 1, "description": "Token naming the Foundry accounts/projects (mf-<foundryToken>-<env>-<region>). Read by bicep for account/project/toolbox-URL naming." },
        "pattern": { "type": "string" },
        "skuShort": { "type": "object", "additionalProperties": { "type": "string" } }
      }
    },
    "regions": {
      "type": "object",
      "additionalProperties": {
        "type": "object",
        "required": ["dataZone", "primary"],
        "properties": {
          "dataZone": { "type": "string", "enum": ["US", "EU"] },
          "primary": { "type": "boolean" },
          "roles": { "type": "array", "items": { "type": "string" } }
        }
      }
    },
    "catalog": {
      "type": "array",
      "items": {
        "type": "object",
        "required": ["name", "format", "category", "deployments"],
        "properties": {
          "name": { "type": "string" },
          "deploymentNameBase": {
            "type": "string",
            "pattern": "^[a-z][a-z0-9-]{0,31}$",
            "not": { "pattern": "microsoft" },
            "description": "Azure resource-name token for Decision deployments only. Keeps the canonical provider name/model identity unchanged; Microsoft in the provider name is reserved in deployment resource names."
          },
          "displayName": { "type": "string" },
          "format": { "type": "string" },
          "category": { "type": "string" },
          "runtimeEnabled": {
            "type": "boolean",
            "default": true,
            "description": "False keeps this row's deployments and historical metadata in desired infrastructure, quota and retirement inventory, but leaves it with no eligible runtime options or generated HTTP/realtime routes. It is not physical deletion or free quota; deployment removal is a separate operator-approved cleanup."
          },
          "api": {
            "type": "string",
            "enum": ["chat", "responses", "anthropic", "mai", "bfl", "mistral_ocr", "decision"],
            "description": "Provider protocol used by the runtime and gateway. Defaults to chat when omitted."
          },
          "deploymentTarget": {
            "type": "string",
            "enum": ["source", "external-claude"],
            "description": "Defaults to source. external-claude belongs only to the separately approved target account, never the main-stack subscription."
          },
          "samplingSupported": { "type": "boolean" },
          "samplingRequiresNoReasoning": {
            "type": "boolean",
            "default": false,
            "description": "Temperature/top_p require an explicitly selected none effort, never an assumed provider default."
          },
          "maxTokensParameter": {
            "enum": ["max_tokens", "max_completion_tokens"],
            "description": "Catalog-owned Chat Completions output-limit spelling; omitted retains the existing family rule."
          },
          "defaultMaxOutputTokens": {
            "type": "integer",
            "minimum": 1,
            "description": "Optional application output default, no greater than maxOutputTokens and strictly below contextWindow. The published output ceiling remains unchanged."
          },
          "anthropicThinking": {
            "enum": ["disabled", "adaptive"],
            "description": "Explicit external-Claude profile. disabled sends thinking disabled and supports the governed text/tool loop. adaptive omits thinking (provider adaptive thinking), is text-only (toolCalling false) and never captures or replays signed thinking blocks."
          },
          "defaultReasoningEffort": {
            "enum": ["low", "medium", "high"],
            "description": "External Claude's explicit default native effort; must belong to reasoningEffort. Omitted retains the existing profile default."
          },
          "routing": {
            "type": "object",
            "additionalProperties": false,
            "required": ["mode", "models"],
            "properties": {
              "mode": { "enum": ["balanced", "cost", "quality"] },
              "models": {
                "type": "array",
                "minItems": 1,
                "maxItems": 16,
                "uniqueItems": true,
                "items": {
                  "type": "object",
                  "additionalProperties": false,
                  "required": ["format", "name", "version"],
                  "properties": {
                    "format": { "const": "OpenAI" },
                    "name": { "type": "string", "minLength": 1 },
                    "version": { "type": "string", "minLength": 1 }
                  }
                }
              }
            },
            "description": "Exact model-router routing mode and fixed model/version subset. New provider models never join implicitly. References must match enabled source catalog rows."
          },
          "requiredRealtimeProtocol": {
            "const": "ga",
            "description": "Only advertise and route this realtime model on the server-selected GA protocol. Omitted on existing models whose legacy compatibility is retained; never selects or enables a protocol."
          },
          "contextWindow": { "type": "integer", "minimum": 1 },
          "maxOutputTokens": { "type": "integer", "minimum": 1 },
          "toolCalling": { "type": "boolean" },
          "inputModalities": {
            "type": "array",
            "minItems": 1,
            "uniqueItems": true,
            "items": {
              "type": "string",
              "enum": ["text", "image", "audio", "video", "document", "json"]
            }
          },
          "imageSizes": {
            "type": "array",
            "minItems": 1,
            "uniqueItems": true,
            "items": {
              "type": "string",
              "enum": ["1024x1024", "1024x1440", "1440x1024", "1024x1536", "1536x1024", "auto"]
            }
          },
          "imageQualities": {
            "type": "array",
            "minItems": 1,
            "uniqueItems": true,
            "items": {
              "type": "string",
              "enum": ["auto", "low", "medium", "high"]
            }
          },
          "imageEditing": {
            "type": "boolean",
            "default": false,
            "description": "True when Microsoft Learn documents image edits (inpainting) for this Azure OpenAI image model. Allowed only on image rows served by the Azure OpenAI image surface (api chat, format OpenAI). Generated gateway routing opens images/edits only for rows that declare it."
          },
          "imageEditingDefault": {
            "type": "boolean",
            "default": false,
            "description": "Marks the one preferred default editing model. Requires imageEditing; at most one row may declare it. When the row is unavailable at runtime, the first available editing row is used instead; an explicitly requested model is never substituted."
          },
          "reasoningEffort": {
            "description": "Application-supported effort values. Existing OpenAI values are live-probed; Claude values are the documented low/medium/high subset of its thinking-disabled or adaptive text-only profile, not a live compatibility claim. An empty array disables the control.",
            "type": "array",
            "uniqueItems": true,
            "items": {
              "type": "string",
              "enum": ["none", "minimal", "low", "medium", "high", "xhigh", "max"]
            }
          },
          "deployments": {
            "type": "array",
            "minItems": 1,
            "items": {
              "type": "object",
              "required": ["region", "sku", "capacity", "version"],
              "properties": {
                "region": { "type": "string" },
                "sku": {
                  "type": "string",
                  "enum": ["GlobalStandard", "DataZoneStandard", "Standard", "GlobalBatch", "DataZoneBatch"]
                },
                "capacity": { "type": "integer", "minimum": 1 },
                "maxCapacity": {
                  "type": "integer",
                  "minimum": 1,
                  "description": "Optional subscription-specific maximum profile generated from live quota and modelCapacities. Must be >= capacity."
                },
                "maxCapacityPool": {
                  "type": "string",
                  "pattern": "^(global|data-zone:(US|EU)|region:[a-z0-9-]+)$",
                  "description": "Quota pool used to generate maxCapacity. Required with maxCapacity so preflight validates the same global, data-zone, or regional boundary."
                },
                "production": {
                  "$ref": "#/definitions/productionDeployment",
                  "description": "Optional operator-owned production bounds and selection. Omitted on the portable catalog; no selection is inferred from usage or maximum."
                },
                "version": { "type": "string" }
              }
            }
          }
        },
        "if": {
          "required": ["anthropicThinking"],
          "properties": { "anthropicThinking": { "const": "adaptive" } }
        },
        "then": {
          "description": "The adaptive profile is text-only: no tool loop can start, so signed thinking blocks never need replay.",
          "required": ["toolCalling", "inputModalities", "samplingSupported", "reasoningEffort"],
          "properties": {
            "toolCalling": { "const": false },
            "inputModalities": { "const": ["text"] },
            "samplingSupported": { "const": false },
            "reasoningEffort": {
              "minItems": 1,
              "items": { "enum": ["low", "medium", "high"] }
            }
          }
        },
        "allOf": [
          {
            "if": { "properties": { "category": { "const": "decision" } }, "required": ["category"] },
            "then": { "required": ["deploymentNameBase"] }
          },
          {
            "if": { "required": ["deploymentNameBase"] },
            "then": {
              "required": ["api"],
              "properties": {
                "category": { "const": "decision" },
                "api": { "const": "decision" },
                "format": { "const": "Microsoft" }
              }
            }
          },
          {
            "if": { "required": ["defaultReasoningEffort"] },
            "then": {
              "required": ["deploymentTarget", "api", "reasoningEffort"],
              "properties": {
                "deploymentTarget": { "const": "external-claude" },
                "api": { "const": "anthropic" }
              }
            }
          },
          {
            "if": {
              "required": ["samplingRequiresNoReasoning"],
              "properties": { "samplingRequiresNoReasoning": { "const": true } }
            },
            "then": {
              "required": ["api", "samplingSupported", "reasoningEffort"],
              "properties": {
                "api": { "const": "responses" },
                "samplingSupported": { "const": true },
                "reasoningEffort": { "contains": { "const": "none" } }
              }
            }
          },
          {
            "if": { "required": ["maxTokensParameter"] },
            "then": { "properties": { "api": { "const": "chat" } } }
          },
          {
            "if": { "required": ["routing"] },
            "then": {
              "properties": {
                "name": { "const": "model-router" },
                "format": { "const": "OpenAI" },
                "category": { "const": "router" }
              }
            }
          },
          {
            "description": "A protocol requirement is realtime-only metadata.",
            "if": { "required": ["requiredRealtimeProtocol"] },
            "then": { "properties": { "category": { "const": "realtime" } } }
          }
        ]
      }
    }
  },
  "definitions": {
    "capacityInteger": { "type": "integer", "minimum": 0, "maximum": 9007199254740991 },
    "positiveCapacityInteger": { "type": "integer", "minimum": 1, "maximum": 9007199254740991 },
    "evidenceHash": { "type": "string", "pattern": "^[0-9a-f]{64}$" },
    "policyToken": { "type": "string", "pattern": "^[A-Za-z0-9][A-Za-z0-9_.-]{0,127}$" },
    "productionDeployment": {
      "type": "object",
      "additionalProperties": false,
      "required": ["poolId", "critical", "criticalMinimum", "ceiling"],
      "properties": {
        "poolId": { "$ref": "#/definitions/policyToken" },
        "critical": { "type": "boolean" },
        "criticalMinimum": { "$ref": "#/definitions/capacityInteger" },
        "ceiling": { "$ref": "#/definitions/positiveCapacityInteger" },
        "capacity": { "$ref": "#/definitions/positiveCapacityInteger" }
      }
    },
    "productionCapacityPolicy": {
      "type": "object",
      "additionalProperties": false,
      "required": ["version", "id", "subscriptionId", "resourceGroup", "environment", "pools"],
      "properties": {
        "version": { "const": "production-capacity-v1" },
        "id": { "$ref": "#/definitions/policyToken" },
        "subscriptionId": { "type": "string", "pattern": "^[0-9a-fA-F]{8}-[0-9a-fA-F]{4}-[0-9a-fA-F]{4}-[0-9a-fA-F]{4}-[0-9a-fA-F]{12}$" },
        "resourceGroup": { "$ref": "#/definitions/policyToken" },
        "environment": { "type": "string", "pattern": "^[a-z0-9][a-z0-9-]{1,18}[a-z0-9]$" },
        "review": {
          "type": "object",
          "additionalProperties": false,
          "required": ["reference", "reviewedAt", "reportSha256", "catalogSha256", "poolEvidenceSha256"],
          "properties": {
            "reference": { "$ref": "#/definitions/policyToken" },
            "reviewedAt": { "type": "string", "pattern": "^\\d{4}-\\d{2}-\\d{2}T\\d{2}:\\d{2}:\\d{2}(?:\\.\\d{1,6})?(?:Z|\\+00:00)$" },
            "reportSha256": { "$ref": "#/definitions/evidenceHash" },
            "catalogSha256": { "$ref": "#/definitions/evidenceHash" },
            "poolEvidenceSha256": { "$ref": "#/definitions/evidenceHash" }
          }
        },
        "pools": {
          "type": "array",
          "minItems": 1,
          "maxItems": 128,
          "items": {
            "type": "object",
            "additionalProperties": false,
            "required": ["id", "pool", "reserve", "usage"],
            "properties": {
              "id": { "$ref": "#/definitions/policyToken" },
              "pool": {
                "type": "object",
                "additionalProperties": false,
                "required": ["counter", "unit", "scope", "regions", "model", "capacityUnitsPerCounterUnit"],
                "properties": {
                  "counter": { "$ref": "#/definitions/policyToken" },
                  "unit": { "$ref": "#/definitions/policyToken" },
                  "scope": { "type": "string", "pattern": "^(global|data-zone:(US|EU)|region:[a-z0-9]+)$" },
                  "regions": {
                    "type": "array", "minItems": 1, "maxItems": 8, "uniqueItems": true,
                    "items": { "type": "string", "pattern": "^[a-z][a-z0-9]{0,31}$" }
                  },
                  "model": {
                    "type": "object",
                    "additionalProperties": false,
                    "required": ["format", "name", "sku", "versions"],
                    "properties": {
                      "format": { "type": "string", "pattern": "^[A-Za-z0-9][A-Za-z0-9_. -]{0,63}$" },
                      "name": { "$ref": "#/definitions/policyToken" },
                      "sku": { "$ref": "#/definitions/policyToken" },
                      "versions": {
                        "type": "array", "minItems": 1, "maxItems": 128, "uniqueItems": true,
                        "items": { "$ref": "#/definitions/policyToken" }
                      }
                    }
                  },
                  "capacityUnitsPerCounterUnit": { "const": 1, "type": "integer" }
                }
              },
              "reserve": {
                "type": "object",
                "additionalProperties": false,
                "required": ["replacement", "retry", "otherWorkloads"],
                "properties": {
                  "replacement": { "$ref": "#/definitions/capacityInteger" },
                  "retry": { "$ref": "#/definitions/capacityInteger" },
                  "otherWorkloads": { "$ref": "#/definitions/capacityInteger" }
                }
              },
              "usage": {
                "type": "object",
                "additionalProperties": false,
                "required": ["metric", "countPerCapacityHour", "minimumHours", "minimumTotal"],
                "properties": {
                  "metric": { "type": "string", "enum": ["ModelRequests", "InputTokens", "OutputTokens", "TotalTokens"] },
                  "countPerCapacityHour": { "$ref": "#/definitions/positiveCapacityInteger" },
                  "minimumHours": { "type": "integer", "minimum": 24, "maximum": 168 },
                  "minimumTotal": { "$ref": "#/definitions/positiveCapacityInteger" }
                }
              }
            }
          }
        }
      }
    }
  }
}
