{
  "$schema": "./models.schema.json",
  "_comment": "Every deployment pins an explicit version. Existing OpenAI effort values retain governed live observations, including GPT-5.4 minimal (rechecked 2026-10-22). The October refresh adds the documented Responses max effort for GPT-6/GPT-5.6, removes Astra none after an app refusal and successful low-effort control, and enables Sol/Luna sampling only with explicit none effort. GPT-6.1 Sol and Grok 4.7 offerings, versions, lifecycle, SKU defaults and raw quotas were observed 2026-10-22; compatible provider profiles come from official API documentation and require rollout acceptance. Grok uses Chat Completions, its documented max_completion_tokens spelling, and an application default that leaves room within its shared input/output context. External Claude keeps its separately reviewed source/activation contract and existing target inventory unchanged. No tenant, account or credential binding is stored here. See docs/runbooks/feature-enablement.md#cross-tenant-claude-source-contract. New probes must stay SimpleL7Proxy -> APIM -> Foundry.",
  "naming": {
    "_comment": "Naming tokens for the whole stack (single source of truth). `subscriptionToken` is stamped into every model deployment name; `foundryToken` names the Foundry accounts/projects (mf-<foundryToken>-<env>-<region>). main.bicep, scripts/gen-model-catalog.py, scripts/validate-catalog.py, and app/api catalog.py all read these, so changing them here (plus AZURE_ENV_NAME) is what makes a subscription/tenant move 1:1. After changing, run scripts/gen-model-catalog.py to regenerate the runtime catalog. See docs/runbooks/greenfield-standup.md#5-select-environment-posture-and-names.",
    "subscriptionToken": "slurmfactory",
    "foundryToken": "aiforia",
    "pattern": "{model}-{subscriptionToken}-{region}-{skuShort}",
    "skuShort": {
      "GlobalStandard": "glbl",
      "DataZoneStandard": "dz",
      "Standard": "std"
    }
  },
  "regions": {
    "eastus2": {
      "dataZone": "US",
      "primary": true,
      "roles": [
        "chat",
        "voice",
        "image",
        "video"
      ]
    },
    "swedencentral": {
      "dataZone": "EU",
      "primary": true,
      "roles": [
        "chat",
        "voice",
        "image",
        "video"
      ]
    },
    "westus": {
      "dataZone": "US",
      "primary": false,
      "roles": [
        "image",
        "research"
      ]
    }
  },
  "catalog": [
    {
      "name": "gpt-6-astra",
      "displayName": "GPT-6 Astra",
      "format": "OpenAI",
      "category": "chat",
      "api": "responses",
      "contextWindow": 1050000,
      "maxOutputTokens": 128000,
      "toolCalling": true,
      "inputModalities": [
        "text",
        "image"
      ],
      "reasoningEffort": [
        "low",
        "medium",
        "high",
        "xhigh",
        "max"
      ],
      "deployments": [
        {
          "region": "eastus2",
          "sku": "GlobalStandard",
          "capacity": 50,
          "version": "2026-09-03",
          "maxCapacity": 125,
          "maxCapacityPool": "global"
        },
        {
          "region": "eastus2",
          "sku": "DataZoneStandard",
          "capacity": 50,
          "version": "2026-09-03"
        },
        {
          "region": "swedencentral",
          "sku": "GlobalStandard",
          "capacity": 50,
          "version": "2026-09-03",
          "maxCapacity": 125,
          "maxCapacityPool": "global"
        }
      ]
    },
    {
      "name": "gpt-6.1-sol",
      "displayName": "GPT-6.1 Sol",
      "format": "OpenAI",
      "category": "chat",
      "api": "responses",
      "contextWindow": 1050000,
      "maxOutputTokens": 128000,
      "samplingSupported": false,
      "toolCalling": true,
      "inputModalities": ["text", "image"],
      "reasoningEffort": ["low", "medium", "high", "xhigh", "max"],
      "deployments": [
        {
          "region": "eastus2",
          "sku": "GlobalStandard",
          "capacity": 10,
          "version": "2026-09-29"
        },
        {
          "region": "eastus2",
          "sku": "DataZoneStandard",
          "capacity": 10,
          "version": "2026-09-29"
        },
        {
          "region": "swedencentral",
          "sku": "GlobalStandard",
          "capacity": 10,
          "version": "2026-09-29"
        },
        {
          "region": "swedencentral",
          "sku": "DataZoneStandard",
          "capacity": 10,
          "version": "2026-09-29"
        }
      ]
    },
    {
      "name": "gpt-6-sol",
      "displayName": "GPT-6 Sol",
      "format": "OpenAI",
      "category": "chat",
      "api": "responses",
      "samplingSupported": true,
      "samplingRequiresNoReasoning": true,
      "contextWindow": 1050000,
      "maxOutputTokens": 128000,
      "toolCalling": true,
      "inputModalities": [
        "text",
        "image"
      ],
      "reasoningEffort": [
        "none",
        "low",
        "medium",
        "high",
        "xhigh",
        "max"
      ],
      "deployments": [
        {
          "region": "eastus2",
          "sku": "GlobalStandard",
          "capacity": 50,
          "version": "2026-09-22"
        },
        {
          "region": "eastus2",
          "sku": "DataZoneStandard",
          "capacity": 50,
          "version": "2026-09-22"
        },
        {
          "region": "swedencentral",
          "sku": "GlobalStandard",
          "capacity": 50,
          "version": "2026-09-22"
        },
        {
          "region": "swedencentral",
          "sku": "DataZoneStandard",
          "capacity": 50,
          "version": "2026-09-22"
        }
      ]
    },
    {
      "name": "gpt-6-luna",
      "displayName": "GPT-6 Luna",
      "format": "OpenAI",
      "category": "chat",
      "api": "responses",
      "samplingSupported": true,
      "samplingRequiresNoReasoning": true,
      "contextWindow": 1050000,
      "maxOutputTokens": 128000,
      "toolCalling": true,
      "inputModalities": [
        "text",
        "image"
      ],
      "reasoningEffort": [
        "none",
        "low",
        "medium",
        "high",
        "xhigh",
        "max"
      ],
      "deployments": [
        {
          "region": "eastus2",
          "sku": "GlobalStandard",
          "capacity": 50,
          "version": "2026-09-22"
        },
        {
          "region": "eastus2",
          "sku": "DataZoneStandard",
          "capacity": 50,
          "version": "2026-09-22"
        },
        {
          "region": "swedencentral",
          "sku": "GlobalStandard",
          "capacity": 50,
          "version": "2026-09-22"
        },
        {
          "region": "swedencentral",
          "sku": "DataZoneStandard",
          "capacity": 50,
          "version": "2026-09-22"
        }
      ]
    },
    {
      "name": "gpt-5.6-sol",
      "format": "OpenAI",
      "category": "chat",
      "api": "responses",
      "contextWindow": 1050000,
      "maxOutputTokens": 128000,
      "reasoningEffort": [
        "none",
        "low",
        "medium",
        "high",
        "xhigh",
        "max"
      ],
      "deployments": [
        {
          "region": "eastus2",
          "sku": "GlobalStandard",
          "capacity": 50,
          "version": "2026-07-09",
          "maxCapacity": 125,
          "maxCapacityPool": "global"
        },
        {
          "region": "eastus2",
          "sku": "DataZoneStandard",
          "capacity": 50,
          "version": "2026-07-09",
          "maxCapacity": 100,
          "maxCapacityPool": "data-zone:US"
        },
        {
          "region": "swedencentral",
          "sku": "GlobalStandard",
          "capacity": 50,
          "version": "2026-07-09",
          "maxCapacity": 125,
          "maxCapacityPool": "global"
        },
        {
          "region": "swedencentral",
          "sku": "DataZoneStandard",
          "capacity": 50,
          "version": "2026-07-09",
          "maxCapacity": 100,
          "maxCapacityPool": "data-zone:EU"
        }
      ]
    },
    {
      "name": "gpt-5.6-terra",
      "format": "OpenAI",
      "category": "chat",
      "api": "responses",
      "contextWindow": 1050000,
      "maxOutputTokens": 128000,
      "reasoningEffort": [
        "none",
        "low",
        "medium",
        "high",
        "xhigh",
        "max"
      ],
      "deployments": [
        {
          "region": "eastus2",
          "sku": "GlobalStandard",
          "capacity": 50,
          "version": "2026-07-09",
          "maxCapacity": 125,
          "maxCapacityPool": "global"
        },
        {
          "region": "eastus2",
          "sku": "DataZoneStandard",
          "capacity": 50,
          "version": "2026-07-09",
          "maxCapacity": 100,
          "maxCapacityPool": "data-zone:US"
        },
        {
          "region": "swedencentral",
          "sku": "GlobalStandard",
          "capacity": 50,
          "version": "2026-07-09",
          "maxCapacity": 125,
          "maxCapacityPool": "global"
        },
        {
          "region": "swedencentral",
          "sku": "DataZoneStandard",
          "capacity": 50,
          "version": "2026-07-09",
          "maxCapacity": 100,
          "maxCapacityPool": "data-zone:EU"
        }
      ]
    },
    {
      "name": "gpt-5.6-luna",
      "format": "OpenAI",
      "category": "chat",
      "api": "responses",
      "contextWindow": 1050000,
      "maxOutputTokens": 128000,
      "reasoningEffort": [
        "none",
        "low",
        "medium",
        "high",
        "xhigh",
        "max"
      ],
      "deployments": [
        {
          "region": "eastus2",
          "sku": "GlobalStandard",
          "capacity": 50,
          "version": "2026-07-09",
          "maxCapacity": 125,
          "maxCapacityPool": "global"
        },
        {
          "region": "eastus2",
          "sku": "DataZoneStandard",
          "capacity": 50,